
VP R&D לסטארט-אפ רפואי,11/06/2020,GotFriends -- לתפקיד מרתק עם עשייה ועניין רב  נשמח לפגוש מפתח/ת מנוסה בניהול לתקן של VP R&D בסטארט-אפ רפואי המפתח פלטפורמה אשר נועדה להנגיש מעקב רפואי עבור מדינות עולם שני. המוצר הוא B2B2C. הפלטפורמה מאפשרת כיום לבצע צילום של העין ולפענח בעזרת טכנולוגיית Computer vision ובינה מלאכותית ניוונים ומחלות זיהומיות. -- התפקיד הינו בכפיפות למנכ"ל. במסגרת התפקיד צפי לניהול קבוצה של 4 ראשי צוותים ו25 מפתחים. בימים אלו מגייסים במקביל את הצוות. -- ממוקמים בתל אביב  שלחו קורות חיים.,- נסיון של שנתיים בתפקידי VP R&amp;D/CTO/ניהול קבוצה (15 עובדים ומעלה) ---- רקע עשיר בפיתוח <span style="background-color:#FEE7D7;text-decoration:none">Python</span>/Java/NodeJS,1-2 שנים,מרכז  שרון  שפלה,תל אביב,מנהל פיתוח  JAVA  NodeJS,משרה מלאה,
data scientist מנוסה,11/06/2020,G STAT -- צטרפ/י אלינו לצוות הlab של gstat שבו כל הקסם בAI וbig data מתרחש. -- הצוות שלנו מוביל את תחום הML ואנו מתרגשים לצרף אלינו עוד Data Scientist! -- כולנו בצוות עובדים על כמה פרויקטים במקביל  באופן זה אנו גם מיישמים מודלים שכבר עשינו בעבר וגם עובדים על רעיונות חדשניים -- הפרויקטים כוללים פיתוח בפועל של אלגורתמי ML  ליווי והדרכה מקצועית של הצוותים האנליטיים  ופיתוח מתודולוגיות חדשניות בהתאם לuse case. שיטת העבודה היא אגילית מהירה  והמודלים יעלו ליישום ויבחנו בפועל. -- בתפקיד זה כל החלטה שלך תשפיע!,ניסיון בפיתוח מודלים בכמה מהתחומים הבאים:  ---Boosting  Regression  Classification  Clustering  recommendation System  Supervised &amp; Unsupervised learning  Unstructured data ---NLP  Embeddings  Dimensionality Reduction PCA  Lstm ---Deep Learning  Audio to Speech  Transfer Learning ---Reinforcement Learning ---תשוקה לפתרון בעיות  ---הנאה לעבוד במקביל במספר פרויקטים ובצוותים שונים ---אחראיות וניהול משימות באופן עצמאי ---<span style="background-color:#FEE7D7;text-decoration:none">Python</span> שפת אם ואב --- ---אנו נספק לך: ---הזדמנות להובלה מקצועית של צוותים ---קידום מהיר למסלול ניהולי ---השתתפות במעבדות שלgstat לפיתוח וקידום מתודולוגיות AI ---צוות חברים גם לחשיבה וגם לבירה ---והמון המון ניסיון מעשי,3-4 שנים,מרכז,פתח תקווה,Data Scientist  Python  Machine Learning,משרה מלאה,
Senior Backend Engineer,11/06/2020,אביבית דבוש השמה -- 5-10 years of software development experience with an object oriented language (Java  C++  C#  Python  etc.) -- Experience designing and developing complex  distributed systems -- At least 1-2 years experience with -- Advantages: --  -- Experience with machine learning -- Experience with Elasticsearch -- Experience with Unix/Linux environment (development and runtime),BSc or BA in Computer Science or a similar degree  or alumni of an IDF technology unit. ---4 years+ Experience with Back-end development (Node.js or <span style="background-color:#FEE7D7;text-decoration:none">Python</span>) - must !!!  ---Full of general knowledge of computers system ---Familiar with cloud technology and services (AWS)- must !!  ---Familiarity with Git ---NoSQL DB knowledge ---Comfortable with linux environments ---Experience with CI/CD and agile methodologies ---Proficiency in English ---*********** ---An experienced Software engineer (4+ years)  develops Production  scalable systems ---Coding in modern technologies (<span style="background-color:#FEE7D7;text-decoration:none">Python</span> advantage  RoR  Java  Node JS  Scala  etc. ---Creating software with quality built in (SOLID  Tests  Separation of Concerns etc.) ---Love tech  working with smart people and solving complex problems. ---Being a team player. ---Get things done!,3-4 שנים,מרכז  שרון  שפלה  ירושלים  צפון,רמת גן  רעננה  גבעתיים  ראשון לציון  פתח תקווה  הרצליה,JAVA  Python  NodeJS,משרה מלאה,
Automation Team Leader/Automation Engineer,11/06/2020,אביבית דבוש השמה -- Automation Team Leader -- • A Bachelor's degree in Computer Science  Software Engineering  and similar or relevant experience as a developer. -- • At least 5 years of experience in .NET  C# -- • Strong design  coding  and debugging skills (hands on). -- • Very good verbal and written communication skills both Hebrew & English- advantage. -- • Experience as Team Leader / Tech Lead mentoring Junior developers. -- • Experience with TFS and Visual studio. -- • Experience with Behavior-Driven Development frameworks (Cucumber  specflow). -- *********** -- Test & Automation Manager -- חובה ניסיון בפיתוח אוטומציה עם + Java. -- * אחוז HO גבוה לפחות 80-100% -- * עבודה בסביבת Linux- חובה. -- * פיתוח תשתיות מאפס- חובה -- * ניסיון עם Cloud AWS -- * עבודה בסביבה סופר טכנולוגית  דינמית  ומאתגרת,Senior Automation Engineer  ---At least 6 years of experience in software development testing ---Proficiency in JavaScript MUST ---Experience with <span style="background-color:#FEE7D7;text-decoration:none">Python</span> 3 - an advantage. ---Deep automated testing experience in writing  executing and monitoring automated test suites using a variety of technologies such as Selenium  Cucumber/SpecFlow/JBehave  Jest  JavaScript  RESTful APIs. ---Demonstrated experience in building integration test frameworks. ---Advanced code design  coding  debugging and maintenance skills. ---Solid knowledge of design patterns ---Strong analytical and problem-solving skills. ---Working experience with git as source control. ---Be able to clearly communicate complex technical designs and solutions in clear  concise and easily readable format by both technical and non-technical personnel. ---Excellent verbal and written communication skills in English. ---Ability to coach  mentor and train personnel (i.e. test engineers) within a technical organization.,3-4 שנים,מרכז  שרון  שפלה,ראשון לציון  תל אביב  קריית אונו  רמת גן,פיתוח כלי בדיקות  Python  JAVA,משרה מלאה,
Front end Team lead/ Tech lead הקמה,11/06/2020,אביבית דבוש השמה -- At least 6 years of modern web UI development -- Deep understanding in at least one of: React  Angular  ViewJS -- At least 2 years in leadership positions -- Demonstratable experience in solution architecture and technology selection -- CS degree or equivalent experience -- Self-initiated and quick learner -- Public cloud experience -- אנחנו מחפשים פה דמות ניהולית שתנהל את כל תחום ה fe. -- לנהל את כל התחום- קביעת סטאק  ארכיטקטורה  סטנדרטיזיציה של תהליכים  code review...,Front End Developer - ---3 years of experience in JavaScript based web development (Angular 2+  React) ---3 years of experience in HTML5  CSS (Sass / LESS) ---Experience with REST APIs and ---Team player  Self-learning skills  multitasking ---Good interpersonal skills ---Good English level.  ---************** ---At least 4 years of experience in a production Web environment ---Strong knowledge of HTML5  CSS3/SCSS  jQuery  Javascript ---2+ years of experience with Angular/ ReactJS and Redux ---2 years of experience using various testing-oriented and code quality methodologies - big advantage ---************ ---4+ years in Software Engineering --- At least 3 years of experience working with a frontend framework (React  Angular  Vue) --- Strong understanding of CSS and HTML semantics --- Experience in creating software with quality built-in (SOLID  Tests  Separation of Concerns etc.) ---* Experience in coding in modern web technologies (<span style="background-color:#FEE7D7;text-decoration:none">Python</span> advantage  RoR  Java  Node JS etc.) ---* Be a team player and a positive problem solver ---* A love for tech and solving complex problems. ---* Some sort of backend experience and willing to do backend code,5-6 שנים,מרכז  שרון  שפלה  צפון,גבעתיים  פתח תקווה  הרצליה  ראשון לציון  נתניה  כפר סבא  רעננה  רמת גן,Full Stack  Angular  React,משרה מלאה,
ר"צ תשתית אפליקטיבי צוות Middleware,11/06/2020,הורייזן טכנולוגיות -- התפקיד כולל ליווי של מפתחים  טיוב ביצועים  פתרון תקלות ותמיכה בצוותי תפעול. -- פיתוח שירותים ופתרונות אינטגרציה בסביבה מרובת פלטפורמות ומערכות. -- התמקצעות מעמיקה בעולם התשתיות במוצרי אינטגרציה של IBM -- אחראיות על זמינות המערכות  מענה ללקוחות הצוות. -- בחינה והטמעה של פתרונות טכנולוגיים,5 שנות ניסיון כאיש תשתיות. ---נדרש ניסיון קודם בעבודת אינטגרציה  הקמה תמיכה ותחזוקה של שרתי אפליקציה- BPM  Was   MQ   DataPower ועוד. ---נסיון עבודה  עם APIConnect  ---ניסיון עבודה בתשתיות &nbsp;Linux ---נסיון בכתיבת סקריפים &nbsp;(Bash  Perl  <span style="background-color:#FEE7D7;text-decoration:none">Python</span>) ועבודה עם was,5-6 שנים,מרכז  שרון  שפלה,גבעתיים,תשתיות  sys admin win  אינטגרטור,משרה מלאה,
ר"צ devOps,10/06/2020,מטריקס BI -- לחברת Matrix דרוש\ה ר"צ devOps מקצועי ומנוסה לתפקיד מעניין ומתאגר.,ניסיון מוכח של 3 שנים לפחות כ- devOps - חובה! ---ניסיון של שנה לפחות כראש צוות - חובה!  ---ניסיון עם תהליכי CI/CD - חובה ---ניסיון ב- OpenShift  Kubernetes - חובה ---היכרות עם שפת תכנות - עדיפות ל <span style="background-color:#FEE7D7;text-decoration:none">Python</span> ---NoSQL DB (Mongo DB  ELK  Redis) - Big Advantage,3-4 שנים,מרכז  שרון,הרצליה,DevOps  ראש צוות,משרה מלאה,
אנליסט/ית סייבר בבנק מוביל!,10/06/2020,G STAT -- במסגרת התפקיד תעבוד/י בצוות של 12 אנליסטים מדהימים תוך שיתוף פעולה  שיתוף ידע  אכפתיות  התגמשות ועזרה הדדית. תעבוד/י מול גורמים רבים  בכירים  ומגוונים בבנק. תפקיד מרכזי  משפיע  ומשמעותי  המצריך מקצועיות רבה. -- התפקיד כולל זיהוי ותגובה של איומי סייבר על תשתיות ולקוחות לאומי. ניטור בזמן אמת 24/7 אחר התראות ממערכת SIEM. הגנה מפני איומים בתחום ההונאה המקוונת. ניתוח מתקפות סייבר וחקירת אירועי אבטחת מידע שוטפים וחריגים.,לפחות שנת ניסיון בתחום אבטחת המידע - חובה ---לפחות שנת ניסיון בטיפול ותגובה לאירועי סייבר – חובה ---ניסיון קודם בעבודה עם צוות SOC/עבודה ב SOC - יתרון. ---היכרות טובה עם מוצרי אבטחת מידע (FIREWALL   IPS   WAF   DLP   אנטי-וירוס   SIEM וכדומה) – חובה. ---ידע בתחום האפליקטיבי: web application hacking  penetration test - חובה ---הכרות עם מסדי נתונים (כגון oracle  sql) - חובה ---הכרות עם שפות תכנות בסביבת אינטרנט clint/server או שפות scripting (כגון: vb  <span style="background-color:#FEE7D7;text-decoration:none">Python</span>  Perl  Ruby PowerShell) -יתרון ---ידע בפרוטוקולי תקשורת (כגון: Tcp-ip  http  smtp  UDP  HTTPS  ssh) - יתרון ---נכונות לעבודה במשמרות 24/7 - חובה,1-2 שנים,מרכז,לוד,Cyber Analyst  אנליסט אבטחת מידע,משרה מלאה,
Hardware Technician / Practical Engineer,10/06/2020,solaredge -- SolarEdge is a top global leader  manufacturing smart energy solutions. The company's broad range of products encompasses intelligent inverter and storage systems  revolutionary EV charger  and by doing that  we are changing the way electricity is being produced and consumed around the world. --  -- In this position you will join a professional R&D team for an interesting role. You will be expected to build infrastructure and Automation developments with willingness to provide high coverage and quality tests. you will be engaged in the assembly and qualification of new generations of products  from design to implementation and analysis. You will learn the core technology underlining SolarEdge's portfolio and the related tools in the development process. --  -- What will you be doing: --  -- Support the Hardware team from the design and development stages in lab feasibility tests  through board and system tests after layout till we have a certified product ready to mass production. -- component level debugging. -- Plan and execute HW-SW tests. -- Manual and Script Automation tests of the Products. -- Responsible for automatic testers including building the automatic tester stations and writing their automation scripts. -- Troubleshooting of problems and failure.,Education: Technical Electricity degree / certificate (Technician  Practical Engineer). ---Experience in System Debug (Power  Analog  Digital). ---Experience in component level Debug (Power  Analog  Digital). ---Experience in work with basic test equipment (scopes  power meters…). ---Advantage: LabView  Electrician certificate ---Experienced in writing Script Coding Such as <span style="background-color:#FEE7D7;text-decoration:none">python</span>  C#  etc. ---Acquired Knowledge in Power Electronics.  ---Additional Skills: ---Proven hands-on abilities (Process includes work with Screwdrivers  wiring  etc.),3-4 שנים,מרכז  שרון,הרצליה,הנדסאי אלקטרוניקה  הנדסאי חשמל,משרה מלאה  משרה חלקית  משרה זמנית  משמרות,
Web Architect,10/06/2020,CodeValue -- CodeValue is looking for a Web Architect to join our R&D team. --  -- As a Web Architect at CodeValue  you will be responsible for: -- Drive architecture and design  as well as technology stack selection. During implementation  conduct design and code reviews as well. -- Lead projects and mentor other developers. -- Study  analyze  and determine scope and effort estimation for future projects. -- Develop prototypes  POC’s while tackling technological challenges in addition to production ready code. -- Span across multiple platforms such as web apps  mobile apps  and backend services. -- Integrate with all sorts of parts of a system  such as Elastic  Mongo  SQL Server  Redis  Kafka  RabbitMQ  etc. -- Work with cutting edge technologies  such as React  VueJS  Angular 2+  React Native  NativeScript  Ionic  Redux  MobX  NodeJS  Nest  KOA  HAPI  Relay  GraphQL  SocketCluster  etc. -- Work alongside experts and leaders in the field. -- Work on various projects and enjoy diversity. -- Enjoy internal training programs to develop your professional skills.,B.Sc. in Computer Sciences/Computer Engineering/Mathematics or equivalent. ---At least 7 years of hands-on experience with Web development ---At least 2 years of hands-on experience with modern UI frameworks such as Angular 2+  React  VueJS. ---SW Architecture experience  ---Experience with server-side development (.NET/JAVA/C++/C#/NodeJS/<span style="background-color:#FEE7D7;text-decoration:none">Python</span>) ---Experience in a multidisciplinary company or/and complex environment  ---Excellent stakeholder management skills  ---Team leadership experience – an advantage,5-6 שנים,מרכז  שרון  צפון,הרצליה  יקנעם עילית,Vue  React  JavaScript,משרה מלאה,
DevOps מומחה בKubernetes לחברת סטארטאפ,10/06/2020,GotFriends -- סטארטאפ בעולם הסייבר בתחום ה-Threat Hunting מעוניין לצרף לנבחרת שלו DevOps עם שלוש שנות נסיון ומעלה  לפוזיציה יחידה בחברה עם הרבה השפעה ואחריות! -- פועלים לגילוי ממוקד של איומי סייבר על ידי התמקדות בזיהוי של שיטות התקפה לעומת חריגות משגרה. המערכת של החברה מתחברת ל-Data Lake הארגוני ומאתרת את התוקפים המוסתרים ביותר. -- ממוקמים בתל אביב בקרבת קו רכבת  מונים 30 עובדים. מעניקים תנאים טובים. -- מחכים לשמוע ממך!,- 3 שנות נסיון כDevOps ---- נסיון עם Kubernetes ---- Scala או <span style="background-color:#FEE7D7;text-decoration:none">Python</span> ---- Cloud,3-4 שנים,מרכז  שרון  שפלה,תל אביב,DevOps  Cloud  משרות הייטק כללי,משרה מלאה,
DevOps לחברה גלובלית בתחום הבינה מלאכותית,10/06/2020,GotFriends -- בעל/ת נסיון כDevOps? מחפש/ת הזדמנות חדשה? -- נשמח להכיר אותך. אנחנו מפתחים טכנולוגיה הנותנת פתרונות בתחום הבינה המלאכותית. מחפשים DevOps לעבודה כחלק מצוות של 3. -- עובדים בסביבת AWS  Kubernetes  Docker  . אנחנו חברה גלובלית עם פעילות גם באירופה ועתידים לפתוח בקרוב פעילות בארה"ב. -- מעניקים תנאים מעולים! חבילת אופציות  שכר גבוה  ימי חופשה ללא הגבלה  יום בשבוע עבודה מהבית  איזון בית עבודה ומשרדים Dog Friendly.,- 3 שנות נסיון כDevOps ---- סקריפטים ---- AWS ---- Docker או Kubernetes,3-4 שנים,מרכז  שרון  שפלה,תל אביב,DevOps  Cloud  sys admin unix,משרה מלאה,
DevOps לחברת הייטק מובילה בתחום המסחר האלקטרוני,10/06/2020,GotFriends -- חברת הייטק מעולה הממוקמת בהרצליה ונחשבת מהמובילות בתחומה בעולם מגייסת DevOps. -- החברה מפעילה פלטפורמה מאובטחת למסחר אלקטרוני וסליקה עבור מוצרים דיגטליים כגון תוכנות  משחקים ושירותים מקוונים. -- התפקיד הינו הינו כ-Senior ו-Tech Lead בצוות של שלושה אנשי DevOps כחלק ממחלקת Operations  כפיפות לראש צוות DevOps  פיתוח עם   Bash  עבודה בסביבת Linux בעיקר ומעט Windows  עובדים עם AWS. -- ממוקמים בהרצליה  שלחו קורות חיים.,- 3 שנות נסיון כDevOps Linux ---- סקריפטים,3-4 שנים,מרכז  שרון  שפלה,הרצליה,DevOps  sys admin unix  משרות הייטק כללי,משרה מלאה,
מפתח/ת אוטומציה Python לחברה בתחום הסייבר,10/06/2020,GotFriends -- סטארט אפ בתחום הסייבר סקיוריטי מגייס מפתח/ת אוטומציה לעבודה כחלק מצוות. -- הסטארט-אפ הינו חלק מקבוצת חברות עולמית ומצליחה. פיתחו מערכת לניהול וניטור סיכונים ושימוש זדוני לחברות ענק. -- יושבים בקו רכבת תל אביב  מוזמנים/ות לשלוח קורות חיים.,- נסיון של שנתיים בפיתוח אוטומציה <span style="background-color:#FEE7D7;text-decoration:none">Python</span> ---- נסיון מחברות Cyber,1-2 שנים,מרכז  שרון  שפלה,תל אביב,מהנדס QA  איש QA  בדיקות אוטומטיות,משרה מלאה,
Machine Leargning Engineer לסטארט-אפ בתחום הסייבר,10/06/2020,GotFriends -- היי לכם/ן  נשמח לפגוש מפתח/ת אלגוריתמים לעבודת מימוש אלגוריתמים של Machine Learning בPython  עבודה כחלק מצוות הפיתוח. -- התפקיד הינו בחברת סטארט-אפ אשר מפתחת פלטפורמת בינה מלאכותית שתעשה אוטומציה לרמת ה-Security של הקוד. -- מונים 14 עובדים ויושבים בתל אביב.,- 3 שנות נסיון כMachine Learning Engineer או במימוש אלגוריתמים ב<span style="background-color:#FEE7D7;text-decoration:none">Python</span> ---- תואר טכנולוגי או בוגרי יחידה טכנולוגית,3-4 שנים,מרכז  שרון  שפלה,תל אביב,Machine Learning  Python  מהנדס תוכנה,משרה מלאה,
Backend Team Leader,10/06/2020,GotFriends -- חברת איסוף Data לעולם ה-Automotive מגייסת Backend Team Leader. -- החברה פיתחה פלטפורמה מבוססת ענן המיועדת לאיסוף  עיבוד ושיתוף מידע מכלי-רכב מקושרים  ובעתיד גם כלי-רכב אוטונומיים. -- התפקיד כולל ניהול צוות ופיתוח ב-. עובדים בסביבת Flink  Elastic Search  Redis וSpark. -- אם את/ה מחפש/ת תפקיד עם עניין ועבודה בסביבה טכנולוגית - מוזמן/ת לשלוח אלינו קורות חיים!,- 4 שנות נסיון בפיתוח בJava או <span style="background-color:#FEE7D7;text-decoration:none">Python</span> ---- נסיון של שנתיים בניהול ---- נסיון בCloud,3-4 שנים,מרכז  שרון  שפלה,הרצליה,JAVA  ראש צוות  Python,משרה מלאה,
DevOps לחברה בצמיחה,10/06/2020,GotFriends -- חברת סטארטאפ ממומנת היטב (סיימו גיוס של 70 מיליון דולר ובצמיחה) הממוקמת בתל אביב בקרבת רכבת  מגייסת DevOps. עוסקים בפיתוח פלטפורמת Storage המגיעה כתוכנה. -- נשמח לפגוש DevOps מנוסה שרוצה להיות חלק מסיפור הצלחה של סטארטאפ שפועל בחזית הטכנולוגיה עם תנאים מעולים!,- 3 שנות נסיון כDevOps ---- Linux ---- <span style="background-color:#FEE7D7;text-decoration:none">Python</span> או Bash ---- Kubernetes,3-4 שנים,מרכז  שרון  שפלה,תל אביב,DevOps  sys admin unix  Cloud,משרה מלאה,
דרוש/ה איש/אשת שליטה ובקרה,10/06/2020,SQLink -- לארגון פיננסי מוביל הממוקם במרכז דרוש/ה איש/אשת שליטה ובקרה. -- התפקיד כולל מתן מענה לדרישות ניטור על בסיס כלי ניטור ארגוניים או פיתוח. -- תפקיד המשלב יכולת של סיסטם ופיתוח ליצירת פתרונות משולבים. -- הזדמנות מעולה להצטרף לארגון יציב המציע תנאים מעולים!,ניסיון בעבודה עם מערכות שו"ב - הקמת ניטורים ושדרוגים ---ניסיון בפיתוח ממשקים webים ככלי עבודה לצוות המקצועי  ---ניסיון בכתיבת סקריפטים : perl   bash   powershell   <span style="background-color:#FEE7D7;text-decoration:none">python</span> ---כתיבת שאילתות מול בסיסי נתונים ---ידע בסיסי בעולם התשתיות - מערכות הפעלה וינדוס\לינוקס ---ניסיון בכלי אוטומציה - יתרון,1-2 שנים,מרכז  שרון  שפלה,תל אביב,תקשורת / שו"ב  תשתיות  משרות הייטק כללי,משרה מלאה,
Cloud Architect,10/06/2020,בינת תקשורת מחשבים -- לבינת תקשורת מחשבים דרוש ארכיטקט ענן- לתפקיד של תכנון סביבות ענן מבוססות Azure  -- כולל כתיבת ארכיטקטורה והקמת סביבות היברידיות -- בשילוב צד עסקי  הצגה טכנית מערכתית בפני מקבלי החלטות,ידע וניסיון ביישום פתרונות בסביבת ענן ---ידע וניסיון בכתיבת סקריפטים ובשפות Bash  <span style="background-color:#FEE7D7;text-decoration:none">Python</span>  PowerShell  JSON  Log Analytic ועוד ---היכרות ועבודה בסביבות פיתוח וידע ב – JENKINS  ANSIBLE וכו’,3-4 שנים,מרכז  שרון,רמת החייל,Cloud  sys admin unix  Post Sales,משרה מלאה,
