
ר"צ קבוצת אימות פיתוח,07/06/2020,אליפסה הנדסה -- לחברה בתחום התעשייה הבטחונית דרוש/ה ר"צ קבוצת אימות פיתוח -- במסגרת התפקיד: -- · ניהול צוות אימות פיתוח -- · פיתוח מערכות אימות פיתוח -- · עבודת HO והרצת תהליכי אימות פיתוח -- · ניתוח מסמכי אפיון מערכת וכתיבת מסמכי בדיקות -- · אפיון ופיתוח טסטים אוטומטיים -- · בדיקת ביצועי מערכת לאימות תכן (POD) -- · הכרת תפעול המערכות וסיוע בפתרון תקלות פיתוח -- · בקרה ואישור מוכנות המערכות לקראת שחרור גרסאות חומרה/קושחה/תוכנה ללקוח -- · ליווי תהליך אימות הפיתוח וניסויים מול הלקוח בשטח,6+ שנות ניסיון בבדיקות ופיתוח מערכות בדיקה ברמת HO  כולל אפיון והגדרת אוטומציה ---3+ שנות נסיון בניהול והובלת צוותי אימות פיתוח ---היכרות וידע בקידוד שפות תכנות: <span style="background-color:#FEE7D7;text-decoration:none">Python</span> (שפה ראשית מובילה) ו/או #C ---בעל/ת יכולת ניתוח והבנה מערכתית והיכרות עם מתודולוגיות בדיקות ---נסיון עבודה מוכח עם קבוצות אינטגרציה/ פיתוח ועבודה עם צב"דים ---ניסיון בתחום בדיקת מערכות תקשורת  כולל RF ---ניסיון בפיתוח מערכות בדיקה ולדציה למערכות מבוססות RF - יתרון ---תואר ראשון בהנדסת חשמל/אלקטרוניקה/תקשורת/הנדסת תוכנה,5-6 שנים,מרכז  שפלה  דרום,יבנה,ראש צוות אימות פיתוח  בדיקות אוטומטיות  איש אימות פיתוח,משרה מלאה,
Network Engineer,07/06/2020,CPS JOBS -- A leading provider of best-in-class cloud based security solutions is looking for a network expert. -- The network expert team is part of the customer services group  as a network expert you will act as an escalation point for NOC for technical network issues. -- Ensure 24/7 availability of our network  handling day-to-day production network issues. -- Assist in incident response and support customers during network events and attacks. -- Work with network engineering team and architects on network improvement. -- Actively Monitor and React to System Events  Alerts and troubleshoot  investigate and resolve network related issues. -- The position requires on-call duties.,3+ year’s hands-on experience in implementing and troubleshooting complex TCP/IP technologies. ---Must have experience with strong routing and switching concepts – CCNP advantage. ---Must have experience with Cisco/Juniper routing and switching. --- Must have experience with routing protocols  BGP - a must. ---Good communication skills and experience with working with customers - must. ---Knowledge of security equipment (firewalls) and experience with Radware security and ADC&nbsp;products – significant advantage ---Multitasking and work under pressure ---Fluent English ---&nbsp;Advantages: ---Experience with scripting (<span style="background-color:#FEE7D7;text-decoration:none">Python</span>  Bash  TCL  etc) --- Familiarity with Monitoring Systems  &nbsp;. ---Knowledge of&nbsp; - Linux  VMWare etc.,3-4 שנים,מרכז  שרון,תל אביב,sys admin win  תקשורת / שו"ב,משרה מלאה,
Big Data Data Scientist,07/06/2020,G STAT -- בוא/י והצטרף/י לחברת START-UP מדהימה במרכז תל אביב! -- במסגרת התפקיד תוכל/י להתנסות בעבודה בכתיבת תהליכים על כלי BIG DATA מהמתקדמים בשוק. תעבוד/י יחד עם צוות תותחים על מציאת פתרונות ואלגוריתמים חדשים מבוססי DATA שיוטמעו במוצר החברה ויהיו בעלי השפעה עצומה על הארגון והמוצר.,ניסיון בעבודה על נתוני BIG DATA ---ניסיון בפיתוח ב <span style="background-color:#FEE7D7;text-decoration:none">PYTHON</span> - חובה ---פיתוח מודלים מורכבים וניסיון בmachine learning --- ---*המשרה ממוקדמת בתל אביב - על קו רכבת,1-2 שנים,מרכז,תל אביב,Data Scientist  Big Data  Machine Learning,משרה מלאה,
הזדמנות פז לכניסה לתפקיד Junior Data Scientist,07/06/2020,G STAT -- השתלבות בפרויקט משותף של יחידות החדשנות והביקורת בבנק מוביל. התפקיד כולל פיתוח מודלים בתחום הביקורת בבנק מול היחידות השונות  עבודה עם PYTHON  SQL ומודלים מתקדמים של ML תחת ליווי של יחידת האנליטיקה בחדשנות. עיסוק יומיומי בDATA ענק של הבנק  עם הנתונים הכי מרתקים. תפקיד משמעותי ומאתגר  בצוות המורכב ממיטב המוחות  המאפשר הזדמנות לצבירת ניסיון משמעותי כ Data Scientist.,תואר ראשון בהנדסה תעשייה וניהול/מערכות מידע/סטטיסטיקה - חובה ---ניסיון בניתוח נתונים - חובה ---ניסיון של שנתיים בSQL ו <span style="background-color:#FEE7D7;text-decoration:none">PYTHON</span> - חובה ---ניסיון בפיתוח מודלים - חובה ---ניסיון עבודה מול העולם העסקי ---אחריות  עצמאות  יכולת קבלת החלטות ---יכולות אנליטיות  ראייה מערכתית ---יכולת עבודה בצוות ותקשורת בינאישית ---יכולת למידה מהירה ונכונות לעבודה מאתגרת ומאומצת,1-2 שנים,מרכז,תל אביב,Data Scientist  Machine Learning  Python,משרה מלאה,
אנליסט\ית אבטחת מידע,07/06/2020,REALCOMMERCE -- לחברת היי-טק בתל אביב דרוש\ה אנליסט\ית אבטחת מידע -- במסגר התפקיד: -- זיהוי איומי סייבר כנגד הבנק  ניתוחם  אפיון המענה ומתן מענה באמצעות כלי ההגנה -- ניתוח מקרי הונאות כנגד הבנק והטמעת לקחים בכלי ההגנה -- מתן מענה למתקפות סייבר כנגד הבנק -- יישום  הפעלה  תחזוקה ובקרה של כלי סייבר להגנה על הרשת,היכרות עם סביבות ענן (במיוחד Google GCP) ---ניסיון בעבודה עם מערכות הגנה לסביבות ענן כגון CASB ---ניסיון בכתיבת סקריפטים ב-<span style="background-color:#FEE7D7;text-decoration:none">Python</span> ו-powershell ---ידע בעולמות ה-Threat Hunting ---ניסיון והיכרות עם מערכות אבטחת מידע כגון FW  EDR  SIEM ומערכות Big data ---יתרון להיכרות עם Kubernetes וסביבות CI CD ---קורסים רלוונטיים בתחום הסייבר  - CISO  CISSP  CEH  CISM.,3-4 שנים,מרכז,תל אביב,אנליסט אבטחת מידע  Cyber Analyst  חוקר חולשות,משרה מלאה,
אנליסט/ית אשראי,07/06/2020,G STAT -- התפקיד כולל ביצוע אנליזות מורכבות בתחום האשראי לקמעונאים / עסקים. הרצת תהליכים שוטפים ב- SAS ובקרה על איכות וטיב התוצאות. הרצת דוחות שוטפים לניתוח תיק האשראי של הבנק. ביצוע תחקורי נתונים המגיעים מהשטח לגבי תוצאות מודלים שונים המנוהלים במחלקת האשראי. ביצוע ניתוחי AD-HOK בתחום האשראי המגיעים מגורמים שונים במחלקה. בקרה על הקוד הקיים ומציאת פערים בין האפיון ליישום בפועל. פגישות עם גורמים עסקיים להבנת צרכים וחשיבה על הפתרון המתאים ביותר  תוך אפיון ויישום שלו. -- במסגרת התפקיד תעבוד / תעבדי צמוד לאנליסט מנוסה ומיומן בבנק. תבצע/י הרצת תהליכים ודוחות שוטפים  ביצוע בקרות ותחקור נתונים  פגישות עם גורמים עסקיים ועוד. הזדמנות לפיתוח אישי וללמידה מהטובים והמנוסים ביותר בתחום.,תואר ראשון בכלכלה / סטטיסטיקה / הנדסה תעשייה וניהול / מנהל עסקים / מדעי המחשב  ---ניסיון של שנה בעבודה עם SQL - חובה ---היכרות עם R / SAS / <span style="background-color:#FEE7D7;text-decoration:none">PYTHON</span> - יתרון משמעותי ---ניסיון בעולם הבנקאי / הסיכונים / האשראי - יתרון משמעותי ---יכולות למידה מהירות (בייחוד של קוד חדש) ---יכולת עבודה עצמית ---מוטיבציה גבוהה לצבור ניסיון משמעותי ---שירותיות ויכולת עמידה מול לקוח ---מחויבות ומוסר עבודה גבוה,1-2 שנים,מרכז,רמת גן,Data Analyst,משרה מלאה,
SYS LINUX,07/06/2020,וויופוינט השמות -- לחברה מובילה בתחומה בצפון דרוש/ה איש סיסטם לתפקיד מגוון ודינאמי! המשרה מלאה  -- אחריות על תמיכה ושרות בכלל מערכי ה-IT והמעבדות כולל חוות שרתים  מערך שרותי לינוקס  מערכי אחסון תשתיות וירטואליות ועוד.,- 4 שנות נסיון בסביבות מרובות שרתים ---- הכרות עם מערכות LINUX בסביבה מבוזרת חובה!!  ---- הכרות עם מערכי שרתים וירטואליים ---- ניהול ציוד התקשורת ועבודה מול ספקי תקשורת ---- ניהול וידע בסביבת שרתי Windows Active Directory ---- ידע בשפות עליות <span style="background-color:#FEE7D7;text-decoration:none">PYTHON</span>  BASH  PERL ---- נסיון בטיפול במשתמשי קצה ---- תודעת שרות גבוהה  נכונות לגמישות ---- נסיון בכתיבת נהלים  התנהלות מול גורמי רכש - יתרון ---מיקום: זקוקים למספר מוקדים בארץ : אזור קריית גת ואזור הצפון( גוש תפן),3-4 שנים,מרכז  שפלה  צפון,נתניה  חיפה  נהריה  כרמיאל,מנהל רשת  תשתיות  sys admin win,משרה מלאה,
DevOps Engineer,07/06/2020,mPrest Systems -- mPrest Systems  a global provider of mission-critical monitoring & control solutions for the defense  security  utility and IoT sectors is looking for DevOps Engineer.,-Degree in Computer Science/Electronic Engineering ---- At least 3 years of experience in technical foundation in build  release and environments (Public clouds AWS  Hybrid)- nice to have ---- At least 3 years of experience in Groovy  <span style="background-color:#FEE7D7;text-decoration:none">Python</span> and bash programming-must ----  At least 3 years of experience with automation/configuration management tools ---- At least 3 years of experience with CI/CD environment (Git  Jenkins  Nexus/Artifactory Repositories  Docker  K8s  Helm  Maven)-must ---- At least 2 years of proven security and networking experience  ---- At least 3 years of strong experience in working in Linux environments ---- At least 2 years of strong experience with Micro Services &amp; cloud native deployments,3-4 שנים,מרכז  שרון,פתח תקווה,DevOps  Ruby on Rails  Cloud,משרה מלאה,
Full Stack Team Lead,07/06/2020,RYB Technologies -- We are hiring a Full Stack Team Lead focused on developing robust Enterprise Systems. -- This is a remote/work from home position in Israel. --  -- Who you are: -- You take management as a craft seriously. You read  learn and keep advancing your management abilities. -- You are hands-on. -- You have developed micro services and have used message queuing. -- You are a .net expert. -- You are comfortable managing remote employees (within Israel). -- You enjoy working in a dynamic environment.,Requirements: ---At least 7 years of software development experience building enterprise applications. ---At least 2 years experience leading a software team (including code reviews). ---Familiarity with multiple development frameworks. ---Experience with Agile/Scrum. ---Experience with leading edge development tools. ---Experience with: ---C# ---Angular (versions 2 and higher) ---SourceControl/Git ---OOD ---SOA ---Multi-Threading ---Entity Framework\NHibernate\ServiceStack ---SQL ---Web API ---jQuery ---MVC ---Ajax ---RabbitMQ/MSMQ ---Solid organizational skills. ---Native language level of English (both written and spoken).  ---Conversational level of Hebrew. ---  ---  ---Bonus skills to have: ---  ---F# ---NServiceBus ---Kafka ---Docker ---WCF ---Rest ---WindowsServices ---TypeScript ---NativeScript ---Unit Testing ---Elastic Search ---<span style="background-color:#FEE7D7;text-decoration:none">Python</span>,7 שנים ומעלה,מרכז  שרון  שפלה  ירושלים  צפון  דרום  יהודה ושומרון,באר שבע  אשדוד  תל אביב  ראשון לציון  נתניה  חיפה  נהריה  טבריה  ירושלים,ראש צוות  C#  Full Stack,משרה מלאה,
מוביל/ה צוות אוטומציה ב-Python,06/06/2020,QualiTest -- חברת Qualitest מגייסת לפרוייקט ארוך טווח בנס ציונה  מפתח/ת בPython עם ניסיון של שנה+. -- כחלק מדרישות התפקיד -הובלת הפרויקט והרכבת הצוות מאפס. -- לא נדרש ניסיון בהובלה קודם-מהווה יתרון למי שרוצה להתקדם בתחום ולנהל תהליכים מול חברה גדולה העוסקת בתחום הביטחוני.,ניסיון בפיתוח ב-<span style="background-color:#FEE7D7;text-decoration:none">Python</span> - חובה ---אנגלית ברמה גבוהה- חובה ---ניסיון בהובלת תהליכים/צוות- יתרון משמעותי ---סיווג בטחוני אזרחי בתוקף- יתרון משמעותי,1-2 שנים,מרכז  שפלה  ירושלים  יהודה ושומרון,נס ציונה,Python  פיתוח כלי בדיקות,משרה מלאה,
מפתח/ת Full stack בכיר/ת,06/06/2020,Logica-IT -- במסגרת התפקיד פיתוח מוצרים חדשים ותחזוקת מערכות קיימות עם יכולות למידה גבוהות וראש יצירתי  -- עבודה על פרויקטים חדשים ומאתגרים בסביבה טכנולוגית מתקדמת.,ניסיון של 6 שנים פלוס בפיתוח צד שרת ב<span style="background-color:#FEE7D7;text-decoration:none">Python</span>\Java- חובה ---ניסיון של 2 שנים פלוס בפיתוח צד לקוח- ReactJS \Angular- חובה ---ניסיון בתהליכי CI\CD- חובה,5-6 שנים,מרכז,תל אביב,Full Stack  JAVA  Python,משרה מלאה,
QA Automation Engineer - Python,04/06/2020,High Tech Company -- A startup on the field of networking who develops a revolutionary product that improves data traffic on networks looks for a new QA Automation Engineer to join his team. -- Our offices are located in the Sharon area. -- משרה 100538,Network QA Analyst ---Were looking for a network specialist with an excellent understanding of networking services and products to define and develop system test plans and processes  test cases and test scripts.,3-4 שנים,מרכז  שרון  צפון,חיפה  נהריה  טבריה  ירושלים  באר שבע  אשדוד  תל אביב  ראשון לציון  נתניה,בדיקות אוטומטיות  מהנדס QA  איש QA,משרה מלאה,
DevOps Engineer,04/06/2020,High Tech Company -- For a hi-tech company developing an ecommerce platform  with offices in the center משרה 100645,At least 5 years of  hands-on experience as a DevOps engineer managing a cloud based production environment. ---Mastery in Linux and microservices architecture (RedHat   CentOS and Ubuntu) and AWS  ---Experience  with designing  building and operating highly available distributed systems ---Experience in at least one of the following container orchestrators: Kubernetes/OpenShift/ECS or similar ---Proven development experience in ֿ<span style="background-color:#FEE7D7;text-decoration:none">Python</span> or Bash ---Experience with building and maintaining CI/CD pipelines. ---Experience with Docker/K8S ---A team player and a problem solver,5-6 שנים,מרכז  שרון,באר שבע  אשדוד  תל אביב  ראשון לציון  נתניה  חיפה  נהריה  טבריה  ירושלים,DevOps  תשתיות  Cloud,משרה מלאה,
Data Group Manager,04/06/2020,High Tech Company -- -Lead a Data group   developments   roadmap & strategy  architecture and content capabilities. -- -Collaborate with key business stakeholders to identify projects and needs  and define business prioritization across the company. -- - Work with other Engineering Managers to continuously improve data capabilities  and promote relevant frameworks and tools. -- -Lead execution of features and complicated data models  data services  data pipelines  and APIs from inception to production. -- -Set the pace for the personal growth of both engineers and team leads in the group  providing support and mentoring where needed. משרה 100647,-BSc. in computer science/software engineering or a related technical discipline. ----At least 4+ years of experience as a Data Engineer developing data infrastructure or data content. ---- At least 3+ years of experience as a Team Lead successfully managed 10+ Engineers. ----Experience with managing multiple teams (managing managers) is a significant advantage. ----Strong architectural skills ---Proficient with the complexities of data pipelines  and complex distributed systems deployed at scale. ----Great communication skills and the ability to work well cross-functionally. ----Experience/familiarity with tech stack such as Java  <span style="background-color:#FEE7D7;text-decoration:none">Python</span>  Hadoop  Snowflake  Kafka  Hive  Sqoop  Celery  Airflow  Kubernetes  Docker  AWS,7 שנים ומעלה,מרכז  שרון,באר שבע  אשדוד  תל אביב  ראשון לציון  נתניה  חיפה  נהריה  טבריה  ירושלים,מנהל פיתוח  ארכיטקט מערכת  מתכנת,משרה מלאה,
Python Developer,04/06/2020,High Tech Company -- For a startup developing products for data acquisition  with offices in the center  we are looking for a Python Developer. -- As a developer you will be part of a team that builds data driven services. You will develop new server applications   integrate with APIs from leading global companies. Your will need to break through performance and scalability barriers using innovative thinking and cutting edge technology. If NLP problems challenge you way of thought   this is the place to be at. משרה 100650,Degree in computer science or equivalent knowledge ---3 years of programming experience. ---2 years of experience of server side <span style="background-color:#FEE7D7;text-decoration:none">Python</span> coding. ---Extensive hands on experience in designing and developing applications using <span style="background-color:#FEE7D7;text-decoration:none">Python</span> ---Experience with developing large-scale  high-performance applications ---Experience with SQL &amp; noSQL technologies (such as Mysql   Elastic Search  Cassandra) ---Experience with messaging technologies (such as RabbitMQ) ---Experience with Linux (Ubuntu) ---Self-starter  fast learner  can-do attitude and great inter-personal skills  team player ---Strong problem-solving skills and a detail-oriented mindset --- ---Advantage: ---Good knowledge of network/computer security. ---Experience with Android ---Experience with RESTful API ---Experience with data science  NLP and machine learning algorithms ---Experience working with Agile Scrum methodology,3-4 שנים,מרכז  שרון,באר שבע  אשדוד  תל אביב  ראשון לציון  נתניה  חיפה  נהריה  טבריה  ירושלים,מתכנת  מהנדס תוכנה  Python,משרה מלאה,
DevOps Manager / Team Lead,04/06/2020,High Tech Company -- For a software company developing products for data security  with offices in the center. -- We are looking for an experienced hands-on DevOps Manager / Team Lead to join our R&D team. The ideal candidate will need a combination of technical and leadership skills  and passion to build a strong DevOps team and supporting processes. This role will provide exceptional career growth opportunities as you develop and acquire new security skills in the course of your duties. משרה 100651,BSc in Computer Science or equivalent. ---A team player that can thrive in a very dynamic environment. ---5+ years of experience with SaaS products  ---2+ years in management role. ---Experience with public cloud providers (GCP  AWS  Azure). ---Perl  Groovy  <span style="background-color:#FEE7D7;text-decoration:none">Python</span>  CloudFormation/Terraform  Ansible. ---Deep knowledge in TCP/IP  HTTP and Web Protocols. ---Familiarity with web security concepts and practices. ---Extensive experience working in Linux environment. ---Strong command of CI/CD tools (Jenkins  BitBucket Pipelines  CircleCI  etc.) ---Experience with Spinnaker  Kubernetes and Docker. ---Excellent English and communication skills,1-2 שנים,מרכז  שרון,באר שבע  אשדוד  תל אביב  ראשון לציון  נתניה  חיפה  נהריה  טבריה  ירושלים,DevOps  ראש צוות,משרה מלאה,
QA Manager / Team Lead,04/06/2020,High Tech Company -- For a software company developing products for data security  with offices in the center. -- We are looking for an experienced hands-on software QA Manager / Team Lead to join our R&D team. The ideal candidate will need a combination of technical and leadership skills  and passion to build a strong QA team and supporting processes. This role will provide exceptional career growth opportunities as you develop and acquire new security skills in the course of your duties  and help us to build scalable software development and release processes. משרה 100652,BSc in Computer Science or equivalent. ---A team player that can thrive in a very dynamic environment. ---5+ years of experience with SaaS products  2+ years in management role. ---2+ years of experience in QA automation  including infrastructure development. ---Good understanding of web application architecture and cloud infrastructure. ---Understands web applications security challenges and vulnerabilities. ---Scripting and programming experience (Shell  <span style="background-color:#FEE7D7;text-decoration:none">Python</span>  JavaScript). ---Extensive experience working in Linux environment. ---Experience with Test Management Systems. ---Excellent English and communication skills.,1-2 שנים,מרכז  שרון,באר שבע  אשדוד  תל אביב  ראשון לציון  נתניה  חיפה  נהריה  טבריה  ירושלים,בדיקות אוטומטיות  מנהל QA  ראש צוות QA,משרה מלאה,
Senior Full Stack Developer,04/06/2020,High Tech Company -- For a software company developing products for data security  with offices in the center. -- We are looking for an experienced full-stack developer to join our R&D team. You will be building and improving our product  including web GUI  API  services  and infrastructure  working with Big Data  Cloud Services  and other cutting edge full stack modern technologies on a daily basis. משרה 100653,A team player that can thrive in a very dynamic environment ---5+ years of web development experience  SaaS products is a big advantage ---JavaScript ninja experienced with React.js and Node.js. Vue.js is an advantage. ---Experience with MongoDB  Google Firebase and Google BigQuery ---<span style="background-color:#FEE7D7;text-decoration:none">Python</span> experience is a big advantage ---Extensive development experience in Linux environment ---Understands web applications security challenges and vulnerabilities ---Experience with one or more public cloud service providers (GCP  AWS  Azure) ---Web protocols understanding (DNS  HTTP  TCP/IP  SSL/TLS) ---Fluent in English  verbal and written,5-6 שנים,מרכז  שרון,אשדוד  תל אביב  ראשון לציון  נתניה  חיפה,מתכנת  מהנדס תוכנה  Full Stack,משרה מלאה,
