
Head of IT operations,לפני 6 שעות,האקר יו -- About -- For over 20 years  HackerU has been the State of Israel's go-to IT & Cybersecurity training institute. As we expand  we are looking for a Head of IT operations for all of our Israeli and global offices. This position is best filled by an experience and professional IT manager. --  -- Job Description -- At HackerU  we rely on our IT systems to power the solutions that help our employees and students around the globe. We’re seeking an experienced IT manager who can join us on this journey  using his or her technological skills to make us more efficient. In this role  you will analyze our current systems and assets  recommend and implement solutions and upgrades  and provide in-house training. Our ideal candidate has extensive knowledge of network and server maintenance  experience managing staff  overseeing projects and advanced industry knowledge to keep us on the cutting edge. From day one  you’ll have an immediate impact on the day-to-day efficiency of our IT operations  and an ongoing impact on our overall growth. -- Objectives of this Role -- • Maintain essential IT operations  including operating systems  security tools  applications  servers  email systems  laptops  desktops  software  and hardware  including IOT devices -- • Manage projects  solutions  and key responsibilities within a larger business initiative -- • Handle business-critical IT tasks and systems administration -- • Research and evaluate emerging technologies  hardware  and software -- • Track and maintain hardware and software inventory -- • Migrate essential service to the cloud -- Daily and Monthly Responsibilities -- • Analyze department needs  boost productivity  efficiency and accuracy to inform business decisions -- • Ensure network components meet needs and work together seamlessly  using the full range of capabilities  and stay informed about new features and competitive solutions -- • Continuously analyze current process  technologies  and vendors to identify areas of improvement -- • Develop and execute disaster procedures  and maintain data backups -- • Train employees on both software and hardware  troubleshoot  and provide technical support when needed -- • Prepare cost benefits analysis reports when upgrades are necessary  continuously analyzing vendors to ensure they offer the best possible service and value for company needs -- • Integrate/implement software and hardware systems according to the company’s needs -- • The job may include flights to our overseas offices,•	10+ years experience in IT management ---•	Experience with or knowledge of programming languages and operating systems (MS Exchange  Active Directory  and other Windows-based systems)  current equipment and technologies  enterprise backup and recovery procedures  and system performance monitoring ---•	Extensive knowledge and experience with hardware/software virtualization ---•	Extensive knowledge and experience with major cloud platforms ---•	Extensive knowledge in PowerShell  VBS  Batch  and <span style="background-color:#FEE7D7;text-decoration:none">Python</span>  ---•	Expertise with implementing  configuring  and testing solutions ---•	Excellent verbal and presentation skills ---Preferred Qualifications ---•	Proven leadership skills ---•	Ability to communicate with C-level executives ---•	Professional certifications such as MCSE  CCNA  LPI  CCSP  CISO  CISSP ---•	Bachelor’s degree in technology or computer science,7 שנים ומעלה,מרכז  שרון  ירושלים  צפון  דרום,רמת גן,מנהל אבטחת מידע  מומחה אבטחת מידע  אנליסט אבטחת מידע,משרה מלאה,
דרוש/ה Software/Firmware Engineer,לפני 6 שעות,- חסוי - -- A company revolutionizing beekeeping by automation and on-going video monitoring of beehives  via computer vision and AI  is looking for a Software/firmware Engineer -- The company is located in Northern Israel -- *There is an option to work from home a few days a week* --  -- Job Responsibilities: -- - Create software and firmware solutions for running the machine that will change the world. -- - Collaborate with cross-functional design teams such as hardware  electronics  and software.,- At least 5 years of C++ and 2 years <span style="background-color:#FEE7D7;text-decoration:none">Python</span> experience. ---- At least 5 years of experience in the development of embedded systems including sensors  actuators  and communication protocols ---- Hands-on experience in Firmware. Arduino IDE – advantage ---- Back-end and Cloud experience - advantage ---- M.Sc. in Electrical / Computer Engineering - advantage ---- Initiative and risk-taker  responsible and efficient  leadership skills  out of the box thinker. ---- Ability to achieve results in a fast-moving  dynamic environment.  ----Work effectively as a team member  both locally and across the organization. ---- Ability to troubleshoot and analyze complex problems. ---- Excellent communication (written and verbal) and interpersonal skills.,5-6 שנים,מרכז  שרון  צפון,בית העמק,Python  C++ / C  RT / Embedded,משרה מלאה,
DevOps,לפני 6 שעות,קורן טק טכנולוגיות -- לחברת סטארטאפ בינלאומית באזור המרכז בתחום הסייבר דרוש/ה DevOps שיהיה חלק מצוות האחראי על פיתוח ושילוב מוצרי טכנולוגיית איתור הסייבר החדשניים והמתקדמים. -- * תכנון  פיתוח ותחזוקה של תשתיות ענן -- * לייעל את CI / CD ולחדש,· ניסיון של לפחות 4 שנים בעבודה כמהנדס DevOps (בנייה / שחרור / ייצור) ---· ניסיון של 2+ שנים עם שפות תסריטים (<span style="background-color:#FEE7D7;text-decoration:none">Python</span> / Bash / Poweshelll או דומה) ---· ניסיון עם ספקי ענן  שירותי ענן AWS / Azure - חובה  GCP - יתרון ---· עבודה עם מכולות  Kubernetes &amp; Docker - חובה ---· ידע ב- CI / CD Jenkins  Git  BitBucket,3-4 שנים,מרכז,תל אביב,DevOps  Cloud,משרה מלאה,
Software Engineer - media technology group,לפני 6 שעות,nisha group -- לחברה הממוקמת באייר פורט סיטי  דרוש/ה Software Engineer - media technology group -- לתפקיד הכולל פיתוח מוצרים חדשים מבוססי AI. -- אחריות על תכנון  שינוי והטמעה של תשתיות ומוצרי תוכנה שונים תחת קבוצת טכנולוגיות המדיה.,• לפחות 3 שנות ניסיון בפיתוח ניסיון JAVA/<span style="background-color:#FEE7D7;text-decoration:none">PYTHON</span>  ---• ניסיון בארכיטקטורת C / S כולל REST  WebSocket  RPC ---• ניסיון ב- C \ C ++ - יתרון גדול ---• ניסיון בפיתוח תחת סביבות לינוקס - יתרון,3-4 שנים,מרכז  שרון,שוהם,C++ / C  JAVA  מהנדס תוכנה,משרה מלאה,
אנליסט/ית הגנת סייבר ואבטחת מידע,לפני 7 שעות,one systems -- לארגון מוביל בתחום הפיננסי במרכז דרוש/ה אנליסט/ית הגנת סייבר ואבטחת מידע -- התפקיד כולל : -- ביצוע משימות ניתוח לטובת טיוב מענה הארגון לאירועי סייבר ואבטחת מידע. הטמעה וטיוב של כלי ההגנה וליווי תהליכים עסקיים ביהבט סייבר -- זיהוי איומי סייבר   ניתוחם  אפיון המענה ומתן מענה באמצעות כלי ההגנה -- מתן מענה למתקפות סייבר -- יישום הפעלה תחזוקה ובקרה של כלי סייבר להגנה על הרשת,ניסיון בעולמות ה- Threat hunting ו - Big data  ---ידע בניתוח נתונים  ידע בתקשורת  ידע ביצירת Visualizations וידע ב<span style="background-color:#FEE7D7;text-decoration:none">פייתון</span> וכתיבת סקריפטים ---תואר ראשון בתחום  ---קורסים רלוונטים בתחום הסייבר  ---CISM   COSO   CISSP   CEH  ---הסמכות טכניות כגון: קורסי תכנות  ניהול רשתות  ניהול כלי אבטחה,3-4 שנים,מרכז  שרון  שפלה,תל אביב,אנליסט אבטחת מידע  Cyber Analyst  מומחה אבטחת מידע,משרה מלאה,
מגדל ביטוח מגייסת אנליסט/ית BI למחלקת אנליזה!,לפני 7 שעות,מגדל חברה לביטוח -- מגדל  חברת הביטוח המובילה בישראל  מגייסת אנליסט/ית BI לצוות אנליזה עסקית של הארגון. -- תפקיד משמעותי בצוות חדש שמוקם בימים אלה עם המון מקום לגדול ולהתפתח. -- התפקיד כולל: -- פיתוח דשבורדים ניהוליים ודוחות בקרה על פי הגדרת אפיון עסקי והבנת צרכים -- תחקור וניתוח בסיסי נתונים גדולים -- בניית דוחות בכלים אנליטיים מתקדמים הסקת מסקנות וסיוע בתהליכי קבלת החלטות עסקיות. -- ישנה עבודה מול ממשקים רבים בארגון   התנהלות מול דרגים שונים באופן פרוייקטלי . -- *העבודה במשרה מלאה בפתח תקווה,תואר ראשון בהנדסת תעו"נ / כלכלה / סטטיסטיקה/ מדעי המחשב / מתמטיקה. ---1-2 שנות נסיון בניתוח נתונים לעזרה בתובנות והחלטת החלטות עסקיות. ---1-2 שנות ניסיון בעבודה עם כלי BI יתרון ל- Tableau. ---ניסיון קודם בעבודה עם בסיסי נתונים גדולים. ---ידע בשאילתות מורכבות ב- SQL. ---ידע בכלים סטטיסטיים לניתוח נתונים (/SAS/ <span style="background-color:#FEE7D7;text-decoration:none">Python</span>) לפחות אחד – חובה ---יתרון לידע ב - <span style="background-color:#FEE7D7;text-decoration:none">Python</span>. ---יכולת ניתוח והסקת מסקנות ממאגרי מידע גדולים ---ידע ב- Excel ברמה גבוהה. ---ניסיון בפיתוח דוחות והפקת דוחות – יתרון ---*מגדל מעודדת העסקת אנשים /נשים עם מוגבלויות ומנגישה את סביבת העבודה לצרכיהם /ן.,1-2 שנים,מרכז  שרון  שפלה  יהודה ושומרון,פתח תקווה,BI,משרה מלאה,
כלכלן/ית בכיר/ה למחלקת גיוסי הון,לפני 7 שעות,מימון ישיר -- למימון ישיר דרוש/ה כלכלן/ית בכיר/ה למחלקת גיוסי הון -- התפקיד כולל : -- • ניתוח עסקאות מימון – בניית מודלי מימון  בחינת השלכות והטמעת תהליכי עבודה הנגזרים מהעסקה בארגון  ניתוח נתונים. -- • בקרה ודיווח עסקאות- אחריות על בקרת עסקאות ודיווח למשקיעים -- • בקרה תקציבית – ניתוח רווחיות והשפעות על תוצאות החברה  בקרת תקציב המחלקה -- • פיתוח עסקי- שותפות בגיבוש שת"פ עם גופים פוטנציאלים לביצוע עסקאות/שת"פ- ניתוח נתונים  -- מענה לאנליסטים  בניית מצגות,•	בוגר/ת תואר ראשון בכלכלה/ניהול/חשבונאות – חובה. התמחות במימון/תואר שני במנהל עסקים –     ---        יתרון.  ---•	נסיון של לפחות שנתיים בתפקיד כלכלי או עסקי עם אוריינטציה לעסקאות מימון  ---•	אקסל ברמה מעולה– חובה ---•	נסיון בהפקת דוחות BO – יתרון ---•	נסיון בכתיבת מאקרו  SQL ו- <span style="background-color:#FEE7D7;text-decoration:none">PYTHON</span>- יתרון ---•	היכרות מעמיקה ועניין בשוק הפיננסי הישראלי,1-2 שנים,מרכז,פתח תקווה,כלכלנים,משרה מלאה,
דרוש/ה SW/FW Engineer,לפני 7 שעות,- חסוי - -- A company revolutionizing beekeeping by automation and on-going video monitoring of beehives  via computer vision and AI  is looking for a Software/firmware Engineer -- The company is located in Northern Israel -- *There is an option to work from home a few day a week* --  --  -- Job Responsibilities: -- - Create software and firmware solutions for running the machine that will change the world. -- - Collaborate with cross-functional design teams such as hardware  electronics  and software.,- At least 5 years of C++ and 2 years <span style="background-color:#FEE7D7;text-decoration:none">Python</span> experience. ---- At least 5 years of experience in the development of embedded systems including sensors  actuators  and communication protocols ---- Hands-on experience in Firmware. Arduino IDE – advantage ---- Back-end and Cloud experience - advantage ---- M.Sc. in Electrical / Computer Engineering - advantage ---- Initiative and risk-taker  responsible and efficient  leadership skills  out of the box thinker. ---- Ability to achieve results in a fast-moving  dynamic environment.  ----Work effectively as a team member  both locally and across the organization. ---- Ability to troubleshoot and analyze complex problems. ---- Excellent communication (written and verbal) and interpersonal skills.,5-6 שנים,מרכז  שרון  צפון,בית העמק,C++ / C  RT / Embedded  Python,משרה מלאה,
System Validation Engineer,לפני 7 שעות,Rachip -- We are recruiting a System Validation Engineer -- 3-5 years of experience in post silicon validation with strong debug capabilities,Experience in Embedded SW development using C/C++ and Assembly ---Experience in scripting language such as Perl or <span style="background-color:#FEE7D7;text-decoration:none">Python</span> ---Experience in usage of advanced lab equipment and measurement tools,3-4 שנים,מרכז  שרון  צפון,  חיפה,C++ / C  מהנדס תוכנה  Python,משרה מלאה,
DevOps Engineer,לפני 7 שעות,zerto -- Why choose Zerto? --  --  -- Zerto’s industry-changing IT Resilience Platform allows companies to eliminate the risk and complexity of modernization and cloud adoption. Our disruptive platform sets the standard of how companies achieve continuous availability  how they protect  mobilize and back-up their data and applications. --  -- When you chose to join Zerto and be a Zertonian you not only chose to be part of a growing company (with over 600 employees)  with a growing customer base of 8000 customers worldwide. It also means you chose to work in a company that values an open and honest approach  a company that has great respect for our customers  appreciates teamwork  and efforts which leads to execution. Choosing Zerto means choosing to work for a company that encourages its employees to maintain a work-life balance  a company in which we play as hard as we work and one in which we never forget to enjoy the ride! --  -- What will your work be like? -- Maintain and support product release pipeline  for planned product updates and unplanned emergency fixes -- Build  configure and manage tools for fast and reliable deployments of our software. -- Design  implement and develop the continuous integration systems and configuration -- Release process delivery and production stability. -- Analyze performance and stability issues -- Performing root-cause analysis for service interruptions and creating preventative measures for deployment. -- Automation and integration of complex processes. -- Execute initiatives to reduce failures and improve overall performance by leveraging monitoring capabilities. -- Recognize technical needs and recommend suitable technologies. --  -- What’s in it for you? -- In this role  you will help implements new--and improve existing--monitoring and trending solutions! -- You will also Introduce new build systems techniques\technologies and evolve existing systems.,You have a professional background of a minimum of 5 years as a DevOps Engineer ---You hold a strong understanding of DevOps and Software Design principles. ---You have experience with package and artifact management systems such as NuGet server and Artifactory. ---You have experience with CI/CD methodologies. ---Hands-on experience with Continuous Integration tools such as Jenkins  TFS or TeamCity. ---  --- ---Bonus If You Have The Following: --- ---Knowledge in Docker and containerization technologies ---Knowledge in scripting (e.g. BASH  PowerShell  <span style="background-color:#FEE7D7;text-decoration:none">Python</span>  Groovy etc.) ---Experience automating deployments with modern configuration and deployment management systems (e.g. Chef  Puppet  Ansible  SaltStack  etc.).,5-6 שנים,מרכז  שרון  צפון  יהודה ושומרון,הרצליה,DevOps,משרה מלאה,
ראש צוות הפיתוח בסטארטאפ,לפני 8 שעות,optimum -- ניהול פיתוח הכולל תוכנה ומימוש אלגוריתמים בסטארטאפ קטן של machine learning עם לקוחות גדולים בתחום האוטומוטיב,ניסיון בפיתוח מערכות ענן  SaaS  סביבת לינוקס  agile/scrum   ---ניסיון בפיתוח תוכנת AI  אלגוריתמי ML   ---יתרון לניסיון בתחום הרפואי או האוטומוטיב ---רצוי ניסיון בממשקים עם android/ios  מסדי נתונים  java  <span style="background-color:#FEE7D7;text-decoration:none">python</span> ---ניסיון במערכת שהינה scalable הפרוסה בשטח ומשרתת לקוחות enterprise   ---ניסיון בשלבים מפיתוח ועד דיוור גרסאות עובדות  יכולות פיתוח hands-on ---דיווח למנכל ---דיסקרטיות נשמרת,7 שנים ומעלה,מרכז  שרון,כפר סבא,ראש צוות  מנהל פיתוח  ארכיטקט מערכת,משרה מלאה,
איש/אשת שליטה ובקרה,לפני 8 שעות,Logica-IT -- במסגרת התפקיד מתן מענה לדרישות ניטור על בסיס כלי ניטור ארגוניים או פיתוח  תפקיד המשלב יכולת של סיסטם ופיתוח ליצירת פתרונות משולבים.,ניסיון של שנתיים לפחות  (הקמת ניטורים  שדרוגים) בעבודה עם מערכות שו"ב ---יכולת פיתוח ממשקים webים ככלי עבודה לצוות המקצועי- חובה ---יכולות כתיבת סקריפטים : perl   bash   powershell   <span style="background-color:#FEE7D7;text-decoration:none">python</span> ---ניסיון בכלי אוטומציה - יתרון ---כתיבת שאילתות מול בסיסי נתונים ---ידע בסיסי בעולם התשתיות : מערכות הפעלה וינדוס\לינוקס,3-4 שנים,מרכז,תל אביב,תקשורת / שו"ב,משרה מלאה,
דרוש/ה אלגוריתמאי/ת לראייה ממוחשבת,לפני 8 שעות,התעשייה האווירית -- לתעשיה האווירית דרוש/ה אלגוריתמאי/ת ראייה ממוחשבת לפיתוח אלגוריתמים מתקדמים וחדשניים בסביבה טכנולוגית מתקדמת וחדשנית. -- מדובר בסביבת עבודה מתפתחת  צעירה ודינאמית,3 שנות ניסיון כאלגוריתמאי/ת  בתחום ראייה ממוחשבת / מערכות עקיבה אלקטרואופטיות - חובה ---ניסיון בביצוע סקרים  כתיבת מסמכי תכן אלגורתמי ומימוש MATLAB - חובה ---בעל/ת יכולת עבודה עצמאית ---בעל/ת יכולת עבודה בצוות כולל ליווי מהנדסי תוכנה - למימוש תוכנתי על רכיבי חומרה יעודיים ---בעל/ת הבנה מערכתית ויכולת ללוות את הפיתוח האינטגרטיבי והבדיקות המערכתיות ---ניסיון מערכות עקיבה אלקטרו אופטיות- יתרון משמעותי ---ניסיון עם Sensors Video - יתרון ---עבודה בסביבת פיתוח ++ C/ <span style="background-color:#FEE7D7;text-decoration:none">Python</span>  - יתרון,3-4 שנים,מרכז,יהוד,מפתח/ת אלגוריתמים,משרה מלאה,
Senior DevOps engineer,לפני 9 שעות,- חסוי - -- •Design  implement and maintain AWS cloud-native solutions using infrastructure as code methodologies -- •Operate and develop micro-service containerized applications backed by cutting edge technologies -- •Design  build and implement deep observation and monitoring tools and methods -- •Work as part of the R&D teams to provide infrastructural solutions and support -- •Research and implement best DevOps practices and processes including automation  CI/CD  infrastructure and architecture. -- •Work with developers and automation engineers to architect solutions that increase efficiency  scale and reliability.,A minimum of 3+ years of relevant work experience: ---2 years Proven experience with Docker orchestration and Kubernetes ---3 years Proven experience with AWS as an administrator in a production environment ---At least 1 years of software development experience in OOP (Java / <span style="background-color:#FEE7D7;text-decoration:none">Python</span> / JS) ---experience with CI systems and Git  ---Operational  systems or networking knowledge ---Strong passion for details and tackling complex tasks ---Advantage ---Experience with Big Data technologies (Kafka  Cassandra  ElasticSearch  Redis  Spark),3-4 שנים,מרכז  שרון  ירושלים  יהודה ושומרון,תל אביב,DevOps  Python  JAVA,משרה מלאה,
Senior C++/Python Engineer,לפני 9 שעות,- חסוי - -- We are looking for a Senior C++ developer  to design and develop applications  and to coordinate with the rest of the team working on different layers of the infrastructure. Thus  a commitment to collaborative problem solving  sophisticated design  and product quality is essential.,BSc in Computer Science with a solid understanding of object-oriented programming ---Proficient in C++  and <span style="background-color:#FEE7D7;text-decoration:none">Python</span>  with a good knowledge of its ecosystems  at least 5 years of proven relevant experience ---Familiar with various design and architectural patterns ---Skill for writing reusable C++ libraries ---Knowledge of FUSE  OpenSSL  Linux kernel  embedded programming – advantage ---Knack for writing clean  readable C++ code ---Experience with both standalone and embedded open-source relational databases ---Understanding fundamental design principles behind a callable application ---Implementing automated testing platforms and unit tests ---Proficient understanding of code versioning tools such as Git ---Familiarity with CI/CD workflows ---Linux savvy ---Team player  autodidact  excellent communication skills ---Work experience in a storage company – advantage,5-6 שנים,מרכז  שרון  שפלה,תל אביב,C++ / C  RT / Embedded  Python,30000-40000,משרה מלאה,
Senior Backend Developer,לפני 9 שעות,Logica-IT -- חלק מצוות האחראי על פיתוח ותחזוקת המערכות  יישום ממשקים חדשים  הטמעת חוקי ניטור ולוגיקות זיהוי מתקדמות.,ניסיון מוכח בפיתוחFull stack \ Server side לפחות 5 שנים. ---ניסיון מוכח בלפחות שתיים מהשפות הבאות: ---C#  <span style="background-color:#FEE7D7;text-decoration:none">Python</span>  .Net Core  NodeJS  Java ---ניסיון מוכח במסדי נתונים ---יכולת למידה מהירה של כלים ושפות חדשות  יכולת הבנה של הלוגיקה העסקית  נכונות ללמוד ולהתפתח בתחום הסייבר ובפרט ב-SIEM במקביל לעבודות הפיתוח.,5-6 שנים,מרכז,תל אביב,מתכנת,משרה מלאה,
מפתח/ת NodeJS  Python,לפני 11 שעות,ארקדיה -- חברה צעירה ומאתגרת המפתחת מוצרים לשוק ה - Gaming הבינלאומי מחפשת מפתח/ת תוכנה בשפות NodeJS  Python,•	תואר ממוסד אקדמי מוכר ---•	ניסיון של 5-8 שנים בפיתוח תוכנה ---•	שליטה בשפות: NodeJS  <span style="background-color:#FEE7D7;text-decoration:none">Python</span> ---•	רקע והיכרות עם התחומים הבאים - יתרון: ---•	Raspberry PI (Computer) ---•	Linux ---•	Hardware interfaces ---•	Robotics --- ---•	נדרשת יכולת עבודה טובה בצוות דינמי ומגוון ---•	נדרשת יכולות לימוד בזמן קצר והשמה מהירה ---•	העבודה תכלול מחקר/לימוד  מימוש המערכת תוך אינטגרציה עם חומרה. שיתוף פעולה עם צוותי חומרה ותוכנה.,5-6 שנים,מרכז  שרון  שפלה  צפון,רעננה,Python  NodeJS  LINUX / UNIX,משרה מלאה,
